,id,url,propertyType,name,publishedOn,uuid,postalCode,description,address,listingCondition,listingStatus,latitude,longitude,category,price,priceActual,priceMax,priceMin,sqft,livingRooms,beds,bedsMax,bedsMin,baths,isRetirementHome,isSharedOwnership,studentFriendly,images,features,additionalLinks,floorPlan,agentAddress,agentName,agentPhone,availableFrom,floorArea
72,66792612,https://www.zoopla.co.uk/to-rent/details/66792612/,flat,2 bed flat to rent,2024-03-05T12:28:46,CD6056CE-4837-409E-8EDB-B9171BD1F98C,BA1 3EZ,"Property Reference: 2009708.<br><br>We are proud to offer this delightful 2 bedroom, 1 bathroom flat in a great location.<br><br>Available to move in from 10 April 2024, this property benefits from available parking. Property is offered furnished.<br><br>Viewing highly recommended. Contact OpenRent today for more details or to arrange a viewing!<br><br><strong>Summary</strong><br><br>Rent £2,000.00 per month (£461.54 per week)<br>Deposit / Bond is £2,000.00<br><br>Minimum tenancy is 6 months<br>Maximum number of tenants is 2<br><br><strong>Summary &amp; Exclusions:</strong><br>- Rent Amount: £2,000.00 per month (£461.54 per week)<br>- Deposit / Bond: £2,000.00<br>- 2 Bedrooms<br>- 1 Bathrooms<br>- Property comes furnished<br>- Available to move in from 13 April, 2024<br>- Minimum tenancy term is 6 months<br>- Maximum number of tenants is 2<br>- Students welcome to enquire<br>- No Pets, sorry<br>- No Smokers<br>- Family Friendly<br>- Bills not included<br>- Property has parking<br>- No Garden Access<br>- EPC Rating: B<br><br><strong> If calling, please quote reference: 2009708 </strong><br><br><strong>Fees:</strong><br>You will <strong>not</strong> be charged any admin fees.<br><br>** Contact today to book a viewing and have the landlord show you round! **<br>Request Details form responded to 24/7, with phone bookings available 9am-9pm, 7 days a week.<br><br><i>OpenRent endeavours to make all property particulars as accurate and reliable as possible, however if you require any further clarification or information please contact us. When applying for a tenancy using the Rent Now process, you will be required to pay one month's rent and any deposit before moving in. This will be paid to OpenRent and released to the landlord once you have moved in. With OpenRent there are no administration fees to pay. </i><br><br><i>Property Reference two million nine thousand seven hundred and eight</i>","North Building, Bath BA1",pre-owned,to_rent,51.3867793606557,-2.39083356284153,residential,2000,2000,2000,2000,,0,2,2,2,1,False,False,False,"['https://lid.zoocdn.com/u/2400/1800/f0f69246b432fee33a49aaa6a9fcd9f8307cf5f0.jpg', 'https://lid.zoocdn.com/u/2400/1800/c590cb459350706e266a8bb78d5ffab6dfe3c46a.jpg', 'https://lid.zoocdn.com/u/2400/1800/4500d50c1f3b9051978a290a82543d54fa46b7c1.jpg', 'https://lid.zoocdn.com/u/2400/1800/48e8b2163aedeab3917cf1c0e9491ee1775f5d2c.jpg', 'https://lid.zoocdn.com/u/2400/1800/1c272ab31c54d108810085595147bb0cea976690.jpg', 'https://lid.zoocdn.com/u/2400/1800/72dfe05a21c774d3aefe850b08c3f39041798268.jpg', 'https://lid.zoocdn.com/u/2400/1800/5a1b436de64b95d4ccca2d939984db0f34f4e1fb.jpg', 'https://lid.zoocdn.com/u/2400/1800/c076cff1cafff20056c980cfef5ace7c90a1812a.jpg', 'https://lid.zoocdn.com/u/2400/1800/79655382c4abdffc04739bade405f874f1a55a84.jpg', 'https://lid.zoocdn.com/u/2400/1800/10b273fad97d5fdff7e7b549893d813ca1bc72ff.jpg', 'https://lid.zoocdn.com/u/2400/1800/e60cea552dff486efc2e65eab6fae9dc9a370df4.jpg', 'https://lid.zoocdn.com/u/2400/1800/da06960ae49bec67855f907fc014d24ebed56b59.jpg', 'https://lid.zoocdn.com/u/2400/1800/2457e4503daafbf2d921e350abe56761fc5ebcfa.jpg', 'https://lid.zoocdn.com/u/2400/1800/b9b70e0f5e75d6478b71348fc1d0247296f60dc4.jpg']","['No Agent Fees', 'Students Can Enquire', 'Property Reference Number: 2009708']",[],[],"20 Wenlock Road, London",OpenRent,020 3542 2178,2024-04-13T00:00:00,
73,67032898,https://www.zoopla.co.uk/to-rent/details/67032898/,semi_detached,3 bed semi-detached house to rent,2024-04-04T17:07:44,05AC8A5E-CAC1-4F42-BFA0-920DCFA98AD2,BA3 5TE,"Property Reference: 2034945.<br><br>Beautiful cosy cottage, views, woodturner, parking in stunning country side.<br>Available on a rolling monthly basis from April 25th.<br>20 mins drive to Bath, Frome and Wells. 45 mins to Bristol.<br>Pictures on request.<br><br><strong>Summary &amp; Exclusions:</strong><br>- Rent Amount: £1,400.00 per month (£323.08 per week)<br>- Deposit / Bond: £1,400.00<br>- 3 Bedrooms<br>- 1 Bathrooms<br>- Property comes furnished or unfurnished (tenant can decide)<br>- Available to move in from 25 April, 2024<br>- Minimum tenancy term is 3 months<br>- Maximum number of tenants is 2<br>- Students welcome to enquire<br>- No Pets, sorry<br>- No Smokers<br>- Family Friendly<br>- Bills not included<br>- Property has parking<br>- Property has garden access<br>- Property has fireplace<br>- EPC Rating: C<br><br><strong> If calling, please quote reference: 2034945 </strong><br><br><strong>Fees:</strong><br>You will <strong>not</strong> be charged any admin fees.<br><br>** Contact today to book a viewing and have the landlord show you round! **<br>Request Details form responded to 24/7, with phone bookings available 9am-9pm, 7 days a week.<br><br><i>OpenRent endeavours to make all property particulars as accurate and reliable as possible, however if you require any further clarification or information please contact us. When applying for a tenancy using the Rent Now process, you will be required to pay one month's rent and any deposit before moving in. This will be paid to OpenRent and released to the landlord once you have moved in. With OpenRent there are no administration fees to pay. </i><br><br><i>Property Reference two million thirty-four thousand nine hundred and forty-five</i>","School Lane, Kilmersdon, Radstock BA3",pre-owned,to_rent,51.271916,-2.440988,residential,1400,1400,1500,1250,,0,3,3,3,1,False,False,False,['https://lid.zoocdn.com/u/2400/1800/0db45e2094130d34f2ce284e15fd9cc2e6c14c61.jpg'],"['No Agent Fees', 'Students Can Enquire', 'Property Reference Number: 2034945']",[],[],"20 Wenlock Road, London",OpenRent,020 3542 2178,2024-04-25T00:00:00,
74,43600234,https://www.zoopla.co.uk/to-rent/details/43600234/,flat,1 bed flat to rent,2024-04-09T16:18:22,792A6C1D-9184-49FB-9604-BACF3F5556E3,BA1 3DY,"**Zero Deposit Guarantee Available**<br>Holding Deposit: 317.00<br><strong>summary</strong><br>An immaculate one bedroom ground floor unfurnished apartment in Lower Weston.<br><br>The property is currently being refurbished throughout to a high standard, The renovation works will consist of new flooring throughout, New Bathroom suite and new Glossy White Kitchen. The property will also be painted white throughout.<br><br>The property will be available by the end of May<br><br><strong>description</strong><br>An immaculate one bedroom ground floor unfurnished apartment in Lower Weston.<br><br>The property is currently being refurbished throughout to a high standard, The renovation works will consist of new flooring throughout, New Bathroom suite and new Glossy White Kitchen. The property will also be painted white throughout.<br><br>The property will be available by the end of May<br>.<br><br>While every reasonable effort is made to ensure the accuracy of descriptions and content, we should make you aware of the following guidance or limitations. <br> <br>(1) money laundering regulations – prospective tenants will be asked to produce identification documentation during the referencing process and we would ask for your co-operation in order that there will be no delay in agreeing a tenancy. <br>(2) These particulars do not constitute part or all of an offer or contract. <br>(3) The text, photographs and plans are for guidance only and are not necessarily comprehensive. <br>(4) Measurements: These approximate room sizes are only intended as general guidance. You must verify the dimensions carefully to satisfy yourself of their accuracy. <br>(5) You should make your own enquiries regarding the property, particularly in respect of furnishings to be included/excluded and what parking facilities are available. <br>(6) Before you enter into any tenancy for one of the advertised properties, the condition and contents of the property will normally be set out in a tenancy agreement and inventory. Please make sure you carefully read and agree with the tenancy agreement and any inventory provided before signing these documents.","Station Road, Lower Weston, Bath BA1",pre-owned,to_rent,51.383203,-2.388846,residential,1375,1375,1500,1250,,1,1,1,1,1,False,False,False,"['https://lid.zoocdn.com/u/2400/1800/9febd819d8d514ec2f360a74f815facc0cd5575a.jpg', 'https://lid.zoocdn.com/u/2400/1800/6932811d0581b97d215f009acdf5145a320727e6.jpg', 'https://lid.zoocdn.com/u/2400/1800/97a5ab32472b65643c6934fa60ec28753749678f.jpg', 'https://lid.zoocdn.com/u/2400/1800/a0c34dab36bebee5032a3cfa94f5c07d02e40747.jpg', 'https://lid.zoocdn.com/u/2400/1800/af042e48930ec0203a5bc88c94f6f9adb532935d.jpg', 'https://lid.zoocdn.com/u/2400/1800/2b132b56e18fd1763d4e97dc764e322922d51b02.jpg']","['New Kitchen', 'New Bathroom', 'Unfurnished', 'Rooftop Terrace Garden', 'Close to the ruh', 'Enviable Location', 'New Flooring']",['https://www.allenandharris.co.uk/property/P4170E0221-8601FBFE'],[],"7 Princes Buildings, George Street, Bath",Allen & Harris - Bath,01225 288623,2024-05-31,
75,67087791,https://www.zoopla.co.uk/to-rent/details/67087791/,flat,1 bed flat to rent,2024-04-11T14:08:57,E8EB0D9B-19A0-47E4-993A-A680A3D75D72,BA2 3DR,"Whether you’re studying at the University of Bath and Bath Spa University, The Brook offers much more than just a place to stay. Our excellent facilities, including a fully equipped gym, a cosy cinema room and games area, provide the perfect opportunity to socialise and create long-lasting relationships. When it’s time for work, make the most of our dedicated study spaces, perfect for studying alone and collaborative work.<br><br>Want to enjoy the city and have a seamless journey to uni? The Brook is the perfect place for you. A 15-minute walk will bring you to the heart of the city, with Bath Spa University only a 20-minute bus ride away and Bath University a 26-minute bus ride away. With our amazing range of social spaces and great location, you'll be sure to be living your best student life in Bath.","The Brook, Lower Bristol Road, Bath BA2",pre-owned,to_rent,51.38219,-2.379541,residential,1430,1430,1500,1250,,1,1,1,1,1,False,False,True,"['https://lid.zoocdn.com/u/2400/1800/66fa6cf55a762f0273123ce56857ef333250f2bf.jpg', 'https://lid.zoocdn.com/u/2400/1800/fd7ac86ef6e9f79ab072d2077ef3af31607f0058.jpg', 'https://lid.zoocdn.com/u/2400/1800/419ba6a89c95ff07e4300a236bc5a8023607b44f.jpg', 'https://lid.zoocdn.com/u/2400/1800/0c5b285705fe41ded2ec5155bee48b248d7635af.jpg', 'https://lid.zoocdn.com/u/2400/1800/8f9e53a7fbc7d242760070836959412ccc045e97.jpg', 'https://lid.zoocdn.com/u/2400/1800/5fba30c7ad1704c1bd59ec5befab0a0774eb9457.jpg', 'https://lid.zoocdn.com/u/2400/1800/ac6c6d04103047ed439b8fb7bf5c454c7a4a5226.jpg', 'https://lid.zoocdn.com/u/2400/1800/85fd67ed73fc4c0f2a5f35ad935bacab0c3c9559.jpg', 'https://lid.zoocdn.com/u/2400/1800/4227bfae14ace76ea68b54de12015ba1b95f8585.jpg', 'https://lid.zoocdn.com/u/2400/1800/d7326ab1486305136a15b2b3c35872a096ffe6dd.jpg', 'https://lid.zoocdn.com/u/2400/1800/f35417239bc3a636a6c006f69316b2ccb5ada404.jpg', 'https://lid.zoocdn.com/u/2400/1800/dffe7a10a14bf1d620c1a49b3f226fdf9226f56e.jpg', 'https://lid.zoocdn.com/u/2400/1800/b1beaf0a7e5795e13cf66b0108c2e76b16653d4a.jpg', 'https://lid.zoocdn.com/u/2400/1800/435c5c6cc68f870f650e8b0cca050fccd9929724.jpg']","['Students only', 'No professionals/families', 'Available September 2024', 'Starting from £329 a week']",[],[],"Signals Drive, Coventry",Fearn Malone,024 7511 7685,2024-09-01,
76,67033101,https://www.zoopla.co.uk/to-rent/details/67033101/,detached,3 bed detached house to rent,2024-04-04T18:06:53,3B6CDC7C-6AAF-4128-A8C0-86378AFC3EDF,BA2 7QT,"Call Forest Marble 24/7 and interact with the virtual tour to book your viewing on this charming detached house located in the picturesque village of Woolverton near Bath. This lovely property features 3 bedrooms, 2 bathrooms, and ample open parking space for 2 vehicles. With a building area of 915sqft, this home offers a cosy and comfortable living space for you and your family. The property boasts a beautiful interior with hardwood flooring, a fireplace, and a spacious living / dining room perfect for entertaining guests. The well-maintained lawn and outdoor walkways provide a serene setting for relaxation and outdoor activities. Located in a peaceful neighbourhood, Ivy Cottage is the perfect place to call home. Contact us today to schedule a viewing and make this dream home yours! To interact with the virtual tour please follow this link <br><br>what3words: Monkey.supposes.overlooks","Woolverton, Bath BA2",pre-owned,to_rent,51.284526,-2.300718,residential,2000,2000,2000,2000,915,1,3,3,3,2,False,False,False,"['https://lid.zoocdn.com/u/2400/1800/9d63c35793c10001ee4d65ecd1770136a57f6f85.jpg', 'https://lid.zoocdn.com/u/2400/1800/dae1de57af41f270f648f089de50c7fc841f4e7f.jpg', 'https://lid.zoocdn.com/u/2400/1800/692702876cc02b4cdda5b29d2bfaf15a71fb41d5.jpg', 'https://lid.zoocdn.com/u/2400/1800/07a40919340fb58ea8a843edceb89d31a2ccb951.jpg', 'https://lid.zoocdn.com/u/2400/1800/30bf96044c6d8c87e6ad27a7a785dcf055648ce3.jpg', 'https://lid.zoocdn.com/u/2400/1800/8494b0e8a3af830f6cddda5466b7821addd67ff8.jpg', 'https://lid.zoocdn.com/u/2400/1800/da03387ba6610de30c9672af80717627eefb45db.jpg', 'https://lid.zoocdn.com/u/2400/1800/a27e39b3a07d275fece331063b188cf9ee5d098c.jpg', 'https://lid.zoocdn.com/u/2400/1800/545914bc1182e617b1518515c3899bd46d2178ee.jpg', 'https://lid.zoocdn.com/u/2400/1800/d27a2a16974018d6e7c0f8e6a1f08f9c5561d0d2.jpg', 'https://lid.zoocdn.com/u/2400/1800/463e3ee84e9e92fb64d6d6fdd29f6bdbe057c4cf.jpg', 'https://lid.zoocdn.com/u/2400/1800/6058aa50e9f95977cd0fccfe0ccbea5672322084.jpg', 'https://lid.zoocdn.com/u/2400/1800/a1196d2e12f26ddebed26750d677fd4d8efd8783.jpg', 'https://lid.zoocdn.com/u/2400/1800/5ba9e566641377ba220981fe67e7fdac787a7cfc.jpg', 'https://lid.zoocdn.com/u/2400/1800/14e0008ace1b3405956b9c8967b98fb50d0c873b.jpg', 'https://lid.zoocdn.com/u/2400/1800/876db8252bd52d7b93ea5070258fcf3fc734f590.jpg']","['Character Cottage Available Now', 'Countryside Views', 'Furnished', 'Open Plan Living', 'Three Bedrooms', 'Two Bathrooms']",['https://lc.zoocdn.com/7463df965e4b79b528e594f6efe1b895a089354c.pdf'],['https://lc.zoocdn.com/a70aafa309a5aae3602fe064c89f8aa011b01c1f.jpg'],"4 Harris Close, Frome, Somerset,",Forest Marble,01373 316923,2024-04-04,915.0
77,58667808,https://www.zoopla.co.uk/to-rent/details/58667808/,flat,1 bed flat to rent,2024-02-28T10:07:55,5fa8ea7e-5b44-4604-a137-c1c6b9d8d0ce,BA2 4EZ,"Holding Deposit: Not currently available, please contact the branch<br><strong>summary</strong><br>Accommodation offering a variety of well-furnished studios and apartments to students. Each studio provides high-speed wifi, 24x7 CCTV camera, management team, laundry facilities, TV room, bike storage and outside courtyards.<br><br>The property is close to multiple universities. The University of Bath and Bath Spa University are only a short bus ride away. Nearby stations are Bath Spa station, Esso Station, and Oldfield Park. Students must visit The Roman Baths, Angel of Peace, The Jane Austen Centre. Popular restaurants and bars around include Noya's Kitchen, Thai Hut, Sotto Sotto, and Olive Tree Restaurant.<br><br>Prices range between £291- £379 per week.<br><br>Please note, when enquiring your details will be passed directly to the landlord.<br><br><strong>Description</strong><br>Accommodation offering a variety of well-furnished studios and apartments to students. Each studio provides high-speed wifi, 24x7 CCTV camera, management team, laundry facilities, TV room, bike storage and outside courtyards.<br><br>The property is close to multiple universities. The University of Bath and Bath Spa University are only a short bus ride away. Nearby stations are Bath Spa station, Esso Station, and Oldfield Park. Students must visit The Roman Baths, Angel of Peace, The Jane Austen Centre. Popular restaurants and bars around include Noya's Kitchen, Thai Hut, Sotto Sotto, and Olive Tree Restaurant.<br><br>Prices range between £291- £379 per week.<br><br>Please note, when enquiring your details will be passed directly to the landlord.<br><br>While every reasonable effort is made to ensure the accuracy of descriptions and content, we should make you aware of the following guidance or limitations. <br> <br>(1) money laundering regulations – prospective tenants will be asked to produce identification documentation during the referencing process and we would ask for your co-operation in order that there will be no delay in agreeing a tenancy. <br>(2) These particulars do not constitute part or all of an offer or contract. <br>(3) The text, photographs and plans are for guidance only and are not necessarily comprehensive. <br>(4) Measurements: These approximate room sizes are only intended as general guidance. You must verify the dimensions carefully to satisfy yourself of their accuracy. <br>(5) You should make your own enquiries regarding the property, particularly in respect of furnishings to be included/excluded and what parking facilities are available. <br>(6) Before you enter into any tenancy for one of the advertised properties, the condition and contents of the property will normally be set out in a tenancy agreement and inventory. Please make sure you carefully read and agree with the tenancy agreement and any inventory provided before signing these documents.","Pulteney Road, Bath BA2",pre-owned,to_rent,51.382816,-2.351842,residential,1643,1643,1750,1500,,0,1,1,1,,False,False,False,"['https://lid.zoocdn.com/u/2400/1800/6af01c9220d2f65f9d92944318cc27463cefb57b.jpg', 'https://lid.zoocdn.com/u/2400/1800/4f4be520a7c511728f3e891e221f340174d19f35.jpg', 'https://lid.zoocdn.com/u/2400/1800/c0affe788b4983162c098e068d73d653d6827873.jpg', 'https://lid.zoocdn.com/u/2400/1800/fef2731d02083a043d9fe02dbe8feb287390b9f4.jpg', 'https://lid.zoocdn.com/u/2400/1800/dbb7b69841501bf716fc8e66c59c600cb32d51a0.jpg', 'https://lid.zoocdn.com/u/2400/1800/4bdace24f55a23d2548300456985fb9b2766c535.jpg', 'https://lid.zoocdn.com/u/2400/1800/8bf78209cd7123918c8ba9dd045777617bce37a0.jpg', 'https://lid.zoocdn.com/u/2400/1800/d84ea1baeface11a8f7cccd731eef61837126bae.jpg', 'https://lid.zoocdn.com/u/2400/1800/d832dc6046a5f2a61f9ac6355d550df37fe940d1.jpg', 'https://lid.zoocdn.com/u/2400/1800/cfa4e56a62e1e4a04db22c7ccb67a8bab9119344.jpg']","['Student Accommodation', 'Modern Apartments', 'Henrietta Park Nearby', 'All Bills Included', 'Fully Furnished']",['https://www.allenandharris.co.uk/property/P2469F2620-3BE8C9AB'],[],"7 Princes Buildings, George Street, Bath",Allen & Harris - Bath,01225 288623,2024-09-21,
78,65373456,https://www.zoopla.co.uk/to-rent/details/65373456/,flat,1 bed flat to rent,2023-08-15T09:20:25,933A43C1-2201-4AE0-AF93-FF3ADD627B25,BA1 1UH,"Ambry House offers beautiful spacious apartments which are perfectly located in the heart of historic Bath close to the Theatre Royal. An entire Georgian terrace has been restored to create a selection of individually designed flats. These stylish apartments are furnished with contemporary furniture, fully equipped kitchens, spacious living/dining area and bedrooms with 4ft double size beds and bathrooms with bath and power shower.<br><br>Richly detailed and filled with light, these spacious flats offer all of the gracious conveniences of modern living inside a beautifully renovated historic building. A mix of original architecture, modern interior design, they come with stories to tell-but also with room for you to tell your own.","Amrby House, St. James's Parade, Bath BA1",pre-owned,to_rent,51.379269,-2.360687,residential,1820,1820,2000,1750,,0,1,1,1,1,False,False,True,"['https://lid.zoocdn.com/u/2400/1800/9392ca71ee234d3f2eb28c219ea089e479d3c23d.png', 'https://lid.zoocdn.com/u/2400/1800/5724ce2dffc67b8e6026a3dccb605cc113af3203.png', 'https://lid.zoocdn.com/u/2400/1800/fd82ab0da307e726ead761b10f2c5597e673854c.jpg', 'https://lid.zoocdn.com/u/2400/1800/0622462794e70de71593504693472f10fac7a2d0.jpg', 'https://lid.zoocdn.com/u/2400/1800/bd46d42eaed9ea487a1fb625a212236f3a5ed97a.jpg', 'https://lid.zoocdn.com/u/2400/1800/f2699cc8ae279d72989b64f056f06973fb4ce518.jpg', 'https://lid.zoocdn.com/u/2400/1800/b9e69e4cb4dd31561fb46e32df8c2d854feb67de.jpg']","['Electricity', 'Gas', 'Internet', 'Satellite Cable TV', 'Step free access', 'Rural/secluded', 'Larger than average room sizes', 'Smart TV included', '3 minute walk to bath spa station']",[],[],"89-95 Redcliff Street, Bristol",Rengen Lettings,0117 295 9938,2024-09-04T00:00:00,
79,56162499,https://www.zoopla.co.uk/to-rent/details/56162499/,terraced,3 bed terraced house to rent,2024-04-09T10:35:29,BFFEE701-687B-4DD2-B30C-5A0DDFF05776,BA2 3JB,"Suitable for X3 professional sharers - This house is situated in this popular suburb of the city close to all local amenities.<br><br>The accommodation is deceptively spacious and offers fine living accommodation throughout consisting of lounge, three bedrooms plus study, bathroom, kitchen, enclosed paved rear garden.<br><br>The property is available unfurnished. Ideal for professional sharers. Available from the 3rd May for a minimum of 12 months<br><br>Council Tax - Band C<br>EPC Rating - D<br><br> Suitable for X3 professional sharers - This house is situated in this popular suburb of the city close to all local amenities.<br><br>The accommodation is deceptively spacious and offers fine living accommodation throughout consisting of lounge, three bedrooms plus study, bathroom, kitchen, enclosed paved rear garden.<br><br>The property is available unfurnished. Ideal for professional sharers. Available from the 3rd May for a minimum of 12 months<br><br>Council Tax - Band C<br>EPC Rating - D<br><br>please note: Unfortunately we cannot rent this property to a family or couple. This is due to the change of use on this property and it must be rented to sharers.","Triangle North, Bath BA2",pre-owned,to_rent,51.377899,-2.38068,residential,1850,1850,2000,1750,,2,3,3,3,1,False,False,False,"['https://lid.zoocdn.com/u/2400/1800/0eabd4b7d0fc942e2350bc35726f9225fa942616.jpg', 'https://lid.zoocdn.com/u/2400/1800/eed3dbbcb99308cedec83a11c0760e4101543f5c.jpg', 'https://lid.zoocdn.com/u/2400/1800/2271d05c54713a0d6ca7fab04c5c4ac61a1ddee3.jpg', 'https://lid.zoocdn.com/u/2400/1800/84f1c07c4a2ead27c928ba6fd292414c4ea299f6.jpg', 'https://lid.zoocdn.com/u/2400/1800/7b2ee2b602d9866962d6919f321d7b2abde26b09.jpg', 'https://lid.zoocdn.com/u/2400/1800/b512717f2c73fe33b434c571f8ae94df03878038.jpg', 'https://lid.zoocdn.com/u/2400/1800/d9d67b45988422b889028ecfd2c78f65d6969106.jpg', 'https://lid.zoocdn.com/u/2400/1800/64f99a33d12cfe1ad935ddab0a97e2d25141fa6e.jpg']","['Gas central heating', 'Double Glazed', 'Three bedrooms plus study', 'Close to Moorland Road', 'Light and Airy', 'Ideal for x3 professional sharers']",['https://www.vebra.com/details/property/33015007'],['https://lc.zoocdn.com/74872a2eb2678b5db959fe2cf2d132a7218ff07b.jpg'],"7 Sussex Place, Bath",Bath Property Shop,01225 288033,2024-05-03T00:00:00,
80,66750387,https://www.zoopla.co.uk/to-rent/details/66750387/,semi_detached,3 bed semi-detached house to rent,2024-02-28T15:54:16,6432D845-AD67-466E-B9E0-DC254F7AEF00,BA2 7UR,"Freshford, BA2<br><br>- Charming 3 bedroom semi-detached property in the desirable village of Freshford<br><br>- Newly fully refurbished throughout<br><br>- The ground floor compromises hallway, a large modern open plan kitchen / dining room with bi-fold doors opening into the garden at the rear, additional light living room to the front, and downstairs WC<br><br>- Stairs to first floor with two generously sized double bedrooms and family bathroom<br><br>- Third floor with the master bedroom and en-suite shower room<br><br>- Large enclosed rear garden with terraced area<br><br>- Benefits from allocated off-street parking for two vehicles<br><br>- Freshford is a popular village with a shop, community hall and a pub, as well as a railway station with regular connections to Bath, Bristol and London.<br><br>- Pets considered at the Landlord’s discretion<br><br>Please note that the pictures will be updated shortly. Further work has been completed since they were taken. Only snagging is left to do at the house.","Freshford Lane, Freshford Lane, Freshford, Bath, Somerset BA2",pre-owned,to_rent,51.338592,-2.311853,residential,2495,2495,2500,2250,,2,3,3,3,2,False,False,False,"['https://lid.zoocdn.com/u/2400/1800/5e2a65c71fde57d5ee88f93d703e527422754c4d.jpg', 'https://lid.zoocdn.com/u/2400/1800/485fa481d7967dac94d9bc378d382f9d9350add1.jpg', 'https://lid.zoocdn.com/u/2400/1800/1d46e5aedc1e64ad7e0f71444b85487d8bea2e76.jpg', 'https://lid.zoocdn.com/u/2400/1800/98b98e503317b7d0ad7b93ff4918e7ec572b0f11.jpg', 'https://lid.zoocdn.com/u/2400/1800/2ddbba29c01415cc86fc60ea692d8d3b49e6bd87.jpg', 'https://lid.zoocdn.com/u/2400/1800/512de799e68d4bd3fa85bee3cfd1bd1d8b6c9072.jpg', 'https://lid.zoocdn.com/u/2400/1800/1a02a1b3e092776619463a7e9c555a5b096051f7.jpg', 'https://lid.zoocdn.com/u/2400/1800/ec753744d9e0fc8170f8429667c3a9b66a59706d.jpg']","['Village location', 'Driveway parking', 'Completely refurbished', 'Open plan kitchen']",[],[],"Brook House, Birmingham Road, Henley-in-Arden",Lettingaproperty,020 8166 5351,2024-03-01,
