,id,url,propertyType,name,publishedOn,uuid,postalCode,description,address,listingCondition,listingStatus,latitude,longitude,category,price,priceActual,priceMax,priceMin,sqft,livingRooms,beds,bedsMax,bedsMin,baths,isRetirementHome,isSharedOwnership,studentFriendly,images,features,additionalLinks,floorPlan,agentAddress,agentName,agentPhone,availableFrom,floorArea
45,67085950,https://www.zoopla.co.uk/to-rent/details/67085950/,flat,1 bed flat to rent,2024-04-11T11:44:23,33C40CEC-4C4A-4389-8D07-B3EFB418A357,BA1 2BT,"<em>Overview:</em><br><br>James House emerges as a top choice for student accommodation in Bath, perfectly marrying convenience with comfort for a truly exceptional living experience. Situated in the vibrant heart of Bath, this student housing option is ideally positioned, near top universities. This central location is surrounded by essential amenities such as supermarkets and lively bars, ensuring students have everything they need right on their doorstep. James House Bath has been carefully designed to offer a warm, welcoming home away from home, with beautifully furnished rooms and superb communal facilities that encourage a sense of community and shared experiences among students.<br><br><em>Features:</em><br><br>James House stands out as a premier choice for student housing in Bath, offering a thoughtfully designed living space with all the amenities necessary to enrich your university life. The accommodation features a range of studio and shared apartments, each equipped with a comfortable 3/4 double bed and private en-suite facilities, prioritizing your comfort and convenience. The outdoor area and communal lounge are perfect spaces for socializing or enjoying some alone time, while the study room provides a quiet haven for academic endeavors. Additional conveniences include secure bike storage, a fully-equipped gym, and laundry facilities. Best of all, inclusive rent at James House Bath means budgeting for your living expenses is straightforward and stress-free.<br><br><em>Location:</em><br><br>Choosing James House for your student accommodation in Bath places you in an unbeatable location within the city’s dynamic center. The close proximity to both the University of Bath and Bath Spa University ensures that getting to and from campus is hassle-free. With Sainsbury's just a stone's throw away, daily shopping is incredibly convenient. Moreover, living in James House allows you to easily explore Bath’s rich cultural and leisure offerings, including the Georgian Garden and the Mary Shelley House of Frankenstein, enhancing your overall student experience.<br><br><em>Transport:</em><br><br>Benefiting from Bath's excellent bus network, James House offers fantastic connectivity, making it simple for residents to navigate the city. The nearest bus stop, James Street West, is a short walk away, serving as a launchpad to the city’s numerous attractions and retail centers. For those looking to travel further afield, the nearest train station is just a 15-minute walk from James House, facilitating effortless journeys to destinations beyond Bath.<br><br><em>Security &amp; Safety:</em><br><br>Security is a top priority at James House, with advanced CCTV surveillance and a secure key access system in place to ensure the safety of all residents. Our dedicated management team is always on hand to assist with any queries or concerns, allowing you to focus on your studies and enjoy your time in Bath with complete peace of mind.<br><br>By choosing James House for your student housing in Bath, you're not just finding a place to live; you're joining a vibrant community that will greatly enhance your university experience.","James House, James Street West, Bath BA1",pre-owned,to_rent,51.382324,-2.367528,residential,1113,1113,1250,1000,,1,1,1,1,1,False,False,True,"['https://lid.zoocdn.com/u/2400/1800/0c019d18ead34ff7705f5ca01434648c8ee2582a.jpg', 'https://lid.zoocdn.com/u/2400/1800/f636b11ea7ee301c55aee126e6b6ede713ab3528.jpg', 'https://lid.zoocdn.com/u/2400/1800/ee4c697e30f28a62cd4fd02ac8131dd77de851db.jpg', 'https://lid.zoocdn.com/u/2400/1800/435c5c6cc68f870f650e8b0cca050fccd9929724.jpg', 'https://lid.zoocdn.com/u/2400/1800/2b84237a3dd20849d239b0bde20e2b961b603362.jpg', 'https://lid.zoocdn.com/u/2400/1800/01b59dc39f8e3cec20faba78338a8b4e97cfaab8.jpg', 'https://lid.zoocdn.com/u/2400/1800/d7953ca6186323eba458697bfe6924c629e819ed.jpg', 'https://lid.zoocdn.com/u/2400/1800/2aa76c50a2c085783155db1cfe95488b1fd99f65.jpg', 'https://lid.zoocdn.com/u/2400/1800/8459f0b040361e4ce316b603b5a19deb57b1b731.jpg', 'https://lid.zoocdn.com/u/2400/1800/37152b3fd34417507acab18e69b437b5b5f24fe3.jpg', 'https://lid.zoocdn.com/u/2400/1800/0c5b285705fe41ded2ec5155bee48b248d7635af.jpg']","['Student accomodation', 'No families/professionals', 'Available September 2024', 'From £256 a week']",[],[],"Signals Drive, Coventry",Fearn Malone,024 7511 7685,2024-09-01,
46,67063330,https://www.zoopla.co.uk/to-rent/details/67063330/,semi_detached,4 bed semi-detached house to rent,2024-04-09T09:57:13,0B85890E-DB56-4546-96DC-3D9A262FAD15,BA2 5FX,"Lettingaproperty are proud to present this stunning opportunity to reside in the serene neighborhood of Combe Down, Bath. Introducing 9 Naish Road, a spacious and modern semi-detached property that offers the epitome of comfortable living.<br><br>Featuring four generously sized double bedrooms and three bathrooms, this residence ensures ample space and privacy for all occupants. Whether it's for a growing family or professionals seeking room to spread out, this home accommodates diverse lifestyles with ease.<br><br>The heart of this home lies in its expansive kitchen diner, perfect for both casual family meals and entertaining guests. With abundant natural light and ample room for culinary creativity, this space is sure to become the focal point of daily living.<br><br>Convenience is key with off-road parking available, ensuring hassle-free arrivals and departures. The property comes unfurnished, allowing you the freedom to personalize and style the space according to your preferences and needs.<br><br>Situated in the sought-after area of Combe Down, residents will enjoy easy access to local amenities, reputable schools, and scenic walking trails. Bath's vibrant city center is also within reach, offering a myriad of cultural attractions, shopping destinations, and dining experiences.<br><br>Don't miss out on the opportunity to make 9 Naish Road your next home. Contact us today to schedule a viewing and discover the perfect blend of comfort, convenience, and contemporary living in Bath, Somerset.<br><br>This wonderful home could be yours to rent for just £2,500.00 per calendar month and a deposit of £2,884.00.<br><br><em>Details and exclusions:</em><br><br><ul><li>Rent amount per month: £2,500.00</li><li>Deposit amount: £2,884.00</li><li>4 bedrooms</li><li>3 bathrooms</li><li>Property comes with two parking spaces</li><li>Available to move in from </li><li>Bills not included</li><li>Fully Modernised</li><li>Unfurnished</li></ul><br><br><em>Viewing Arrangements - Property Ref: 8017</em><br>To book a viewing at this property, call and <em>quote ref: 8017</em>","Naish Road, Combe Down, Bath, Somerset BA2",pre-owned,to_rent,51.364599,-2.350709,residential,2500,2500,2500,2500,,2,4,4,4,3,False,False,False,"['https://lid.zoocdn.com/u/2400/1800/7c55a03ee0da2254e062bcd281f4a04e8b286d68.jpg', 'https://lid.zoocdn.com/u/2400/1800/32f7e166c5e641fd77148e201cea2af13728fe2a.jpg', 'https://lid.zoocdn.com/u/2400/1800/051feeb5a13e45319825b07a6dffbfe5064e94d9.jpg', 'https://lid.zoocdn.com/u/2400/1800/741e08f1259219f1d24b6e197623430f95200278.jpg', 'https://lid.zoocdn.com/u/2400/1800/2fe2b69dbaed3c170fe54265ff722de5c35a3335.jpg', 'https://lid.zoocdn.com/u/2400/1800/bccb5507beac119ccba9606e3bfd172cbb794b9e.jpg', 'https://lid.zoocdn.com/u/2400/1800/16183692c07b22f416e3f3cbd72496671947174a.jpg', 'https://lid.zoocdn.com/u/2400/1800/71b9b652b45ede059b2a76d1313c4bc5e8a719d3.jpg', 'https://lid.zoocdn.com/u/2400/1800/7a9fd2adff9dcd9f7d846d7dba4f71ea186172d7.jpg', 'https://lid.zoocdn.com/u/2400/1800/37cca76418c41cc742a5803b10cc55c222b6d2f7.jpg', 'https://lid.zoocdn.com/u/2400/1800/197070b8f0ee618a47e5331d79b71ebd1e7d918a.jpg', 'https://lid.zoocdn.com/u/2400/1800/254232ed83d01c428c10d7a224c4290334e9b786.jpg', 'https://lid.zoocdn.com/u/2400/1800/58fdc4b88a0e2ac6f430ce836a45bf2b6d7b98c2.jpg', 'https://lid.zoocdn.com/u/2400/1800/6fbf94c9b32ead2fc4ff64dcfe8bd635d28110c0.jpg', 'https://lid.zoocdn.com/u/2400/1800/21d75fa8e3524324ea1c014097d6c123deeac9d7.jpg', 'https://lid.zoocdn.com/u/2400/1800/8b79dfc1fd3e6cf4f4f900b5f24b40a57d2cbc9f.jpg', 'https://lid.zoocdn.com/u/2400/1800/2f9c11fc9fb578b32bb9d7dd0698e998ec528e28.jpg', 'https://lid.zoocdn.com/u/2400/1800/55b6a0e7e9050dc49684e99d271f65c24e307a29.jpg', 'https://lid.zoocdn.com/u/2400/1800/d9e230de3aca0733c3ae2ea6a284f1594c8b3c87.jpg']","['Allocated parking', 'Ample storage', 'Available long term', 'Beautiful garden', 'Beautifully presented', 'Bright and airy', 'Bright and spacious', 'Central heating', 'Close to local amenities', 'Close to local schools', 'Desirable location', 'Double glazing', 'Excellent condition']",[],['https://lc.zoocdn.com/f2f243c56ca3fa9cf9d3e2f24021c6ade7f1c79a.jpg'],"Brook House, Birmingham Road, Henley-in-Arden",Lettingaproperty,020 8166 5351,2024-07-01,
47,66885090,https://www.zoopla.co.uk/to-rent/details/66885090/,maisonette,3 bed maisonette to rent,2024-03-15T20:51:01,AC546ACF-D174-4DA2-B910-B5156E4E18DF,BA1 5ST,"Property Reference: 1765510.<br><br><strong>A 3 bedroom</strong> <strong>furnished maisionette just 10 minutes walk from Bath town centre.</strong> This bright and airy maisonette comes with <strong>a lovely garden</strong> and enjoys private front and rear access.<br><br>The spacious property boasts a lounge, dining area, a toilet / cloakroom, a bright modern kitchen with white goods, 3 bedrooms (2 double +1 single), a modern bathroom and great storage.<br><br><strong>Suitable for families, couples or 2 individuals. Not suitable for 3 or more professionals or students sharing. </strong><br><br>Available from 30 April 2024. Street parking with Council parking permit. If required, a garage can be provided with the property. Rent for the garage to be agreed.<br><br><strong>Summary &amp; Exclusions:</strong><br>- Rent Amount: £1,575.00 per month (£363.46 per week)<br>- Deposit / Bond: £1,817.30<br>- 3 Bedrooms<br>- 1 Bathrooms<br>- Property comes furnished<br>- Available to move in from 30 April, 2024<br>- Minimum tenancy term is 6 months<br>- Maximum number of tenants is 5<br>- No Students<br>- No Pets, sorry<br>- No Smokers<br>- Family Friendly<br>- Bills not included<br>- No Parking Available<br>- Property has garden access<br>- EPC Rating: D<br><br><strong> If calling, please quote reference: 1765510 </strong><br><br><strong>Fees:</strong><br>You will <strong>not</strong> be charged any admin fees.<br><br>** Contact today to book a viewing and have the landlord show you round! **<br>Request Details form responded to 24/7, with phone bookings available 9am-9pm, 7 days a week.<br><br><i>OpenRent endeavours to make all property particulars as accurate and reliable as possible, however if you require any further clarification or information please contact us. When applying for a tenancy using the Rent Now process, you will be required to pay one month's rent and any deposit before moving in. This will be paid to OpenRent and released to the landlord once you have moved in. With OpenRent there are no administration fees to pay. </i><br><br><i>Property Reference one million seven hundred and sixty-five thousand five hundred and ten</i>","Lansdown Mansions, Bath BA1",pre-owned,to_rent,51.391196,-2.363821,residential,1575,1575,1750,1500,,0,3,3,3,1,False,False,False,"['https://lid.zoocdn.com/u/2400/1800/941e0f01af330a5a1805c6d8cdb67dbb939a2872.jpg', 'https://lid.zoocdn.com/u/2400/1800/fdbb8e3129668265996c33e8f6527e4c6c0b8c69.jpg', 'https://lid.zoocdn.com/u/2400/1800/3a7fb93229e4fbce8e7cc3807d676c8cbbcf112d.jpg', 'https://lid.zoocdn.com/u/2400/1800/3cc14e80b08a9d51e3103094952bc8d27714245f.jpg', 'https://lid.zoocdn.com/u/2400/1800/28edba25bf748bc15839bed997f7c3cacdba187d.jpg', 'https://lid.zoocdn.com/u/2400/1800/21217528bdec8d605967b015c7edd1fbd83cdea7.jpg', 'https://lid.zoocdn.com/u/2400/1800/e56016528558690e0777f5e997c2c9cc3a92f857.jpg', 'https://lid.zoocdn.com/u/2400/1800/2dbc17072840d5f0d311d863822772970ac4fe40.jpg', 'https://lid.zoocdn.com/u/2400/1800/792a3c6ba98650f47453385eafe81d2882503d54.jpg', 'https://lid.zoocdn.com/u/2400/1800/c605dab7bf00654280207a8823a75acbf49fa474.jpg', 'https://lid.zoocdn.com/u/2400/1800/9ee8f71704f39b0a0e1d0e1789725ead2f07feca.jpg', 'https://lid.zoocdn.com/u/2400/1800/ef4d0b1d5f85b0d21542f7ef7adecf443ff110bd.jpg', 'https://lid.zoocdn.com/u/2400/1800/8d67eb7a909147ea0ca30ff51c9e6e473c3bb19d.jpg', 'https://lid.zoocdn.com/u/2400/1800/dd05aad6fd1f4a18aa7ee3b7b089ac157f622e87.jpg']","['No Agent Fees', 'Property Reference Number: 1765510']",[],[],"20 Wenlock Road, London",OpenRent,020 3542 2178,2024-04-30T00:00:00,
48,66877187,https://www.zoopla.co.uk/to-rent/details/66877187/,end_terrace,3 bed end terrace house to rent,2024-03-15T09:59:50,D254E882-96CD-4135-B754-38C86551D95E,BA2 4DE,"A wonderful Mews house in central Bath, tucked in behind Great Pulteney Street and overlooking the Bath Recreation Ground. The property is arranged over 3 floors and the immaculate accommodation comprises hallway with cloakroom and utility room with washing machine and tumble dryer, through on to Kitchen/Dining Room with integrated appliances of oven with hob, fridge and dishwasher. Stairs rise to the first floor where there is a Sitting Room with two double doors that lead to a balcony with south facing views across to the Recreation Ground. Also on this floor is a double bedroom and a bathroom.<br><br>Stairs rise again to the second floor where there are two further bedrooms and a shower room.<br><br>Externally there is a small garage which would be large enough for storage but not a car. There are two parking permits available for parking on the street in a permit parking zone.<br><br>Council tax band G (Bath &amp; North East Somerset for current cost) . Energy rating band D.<br>Available for a minimum term of 12 months.<br><br>Mains gas central heating, mains electric and metered mains water.<br><br>Internet &amp; Mobile: Further information on availability and speeds can be found at <br><br>At a rent of £3,400 per calendar month:<br>Holding deposit of 1 weeks rent £784.62 (deducted from first month's rent)<br>Security deposit of 5 weeks rent £3,923.08","William Street, Bath, Somerset BA2",pre-owned,to_rent,51.383925,-2.354092,residential,3400,3400,3500,3250,,2,3,3,3,3,False,False,False,"['https://lid.zoocdn.com/u/2400/1800/52c6369c7138cf47baf204656ab9903b17f09591.jpg', 'https://lid.zoocdn.com/u/2400/1800/66f34636fd42ad5ac60c626593d4e261663f9cbf.jpg', 'https://lid.zoocdn.com/u/2400/1800/bf4b1c174c5ed3bfb177265bbe0ec82abe2d33f4.jpg', 'https://lid.zoocdn.com/u/2400/1800/68b86161c1089fae67a8a4a7a65e972ba2bef098.jpg', 'https://lid.zoocdn.com/u/2400/1800/e1a5b1c086864fef94779a8fa6ee53ad383743da.jpg', 'https://lid.zoocdn.com/u/2400/1800/95b3e63f67a6bb8e1f09dcc84a49e92ffcd14897.jpg', 'https://lid.zoocdn.com/u/2400/1800/143d8e2584968bd4247e7ef493fad67a77369ff8.jpg', 'https://lid.zoocdn.com/u/2400/1800/c06af919c5bd9c926c677e5db15f5a84951f1e8c.jpg', 'https://lid.zoocdn.com/u/2400/1800/369f0685d4e9b49517432e6c6451ea011a77218a.jpg', 'https://lid.zoocdn.com/u/2400/1800/e0ae6f1a8a89b079f83e2d4e4a9415ca374b68fe.jpg', 'https://lid.zoocdn.com/u/2400/1800/0ef885bfac9505340ef16030131ac950791e1045.jpg', 'https://lid.zoocdn.com/u/2400/1800/064d8751aaa904bf0fb941a7d5fe87c6b3675cc9.jpg', 'https://lid.zoocdn.com/u/2400/1800/724a2b78a22569be8461a02d90699b7e4910a85e.jpg', 'https://lid.zoocdn.com/u/2400/1800/df14c0c8a37d4c002ccece3ac73fb2095ef8015b.jpg', 'https://lid.zoocdn.com/u/2400/1800/8e37ef8dc8f7e04fc2cfdcb0e261719e12dd00dc.jpg', 'https://lid.zoocdn.com/u/2400/1800/fbff95942d44a882d53a28e8412e91b5b86b794e.jpg']","['3 Floors', '3 Bedrooms', '2 Bathrooms', 'Kitchen/breakfast room', 'Conservatory', 'Utility Room', 'Balcony', 'Garage']",['https://assets.reapit.net/cjo/live/pdf.php?p=BAT240015&t=L'],['https://lc.zoocdn.com/3f2ee0369324426dac5c034370aa3cf8e2fb57f2.jpg'],"5 - 6 Wood Street, Bath",Carter Jonas - Bath,01225 616767,2024-04-15,
49,65682053,https://www.zoopla.co.uk/to-rent/details/65682053/,,3 bed property to rent,2024-03-06T15:05:45,93E462B7-2AED-438E-A3FF-18CA0CC129B8,BA1 6NW,"Holding Deposit: 403.00<br><strong>summary</strong><br>Bricklane in partnership with Allen and Harris.<br><br>This 3 bedroom family home in the sought after area of Fairfield Park, The property comprises of large living room, Separate kitchen and double bedrooms, The property will have some renovation works before the tenancy starts.<br><br>Fairfield Park is close to local amenities including shops and cafes. The property has great transport links to the city centre and surrounding schools.<br><br>£25.00 pcm for pets (if applicable)<br><br>Available May<br><br><strong>description</strong><br>Bricklane in partnership with Allen and Harris.<br><br>This 3 bedroom family home in the sought after area of Fairfield Park, The property comprises of large living room, Separate kitchen and double bedrooms, The property will have some renovation works before the tenancy starts.<br><br>Fairfield Park is close to local amenities including shops and cafes. The property has great transport links to the city centre and surrounding schools.<br><br>£25.00 pcm for pets (if applicable)<br><br>Available May<br><br>While every reasonable effort is made to ensure the accuracy of descriptions and content, we should make you aware of the following guidance or limitations. <br> <br>(1) money laundering regulations – prospective tenants will be asked to produce identification documentation during the referencing process and we would ask for your co-operation in order that there will be no delay in agreeing a tenancy. <br>(2) These particulars do not constitute part or all of an offer or contract. <br>(3) The text, photographs and plans are for guidance only and are not necessarily comprehensive. <br>(4) Measurements: These approximate room sizes are only intended as general guidance. You must verify the dimensions carefully to satisfy yourself of their accuracy. <br>(5) You should make your own enquiries regarding the property, particularly in respect of furnishings to be included/excluded and what parking facilities are available. <br>(6) Before you enter into any tenancy for one of the advertised properties, the condition and contents of the property will normally be set out in a tenancy agreement and inventory. Please make sure you carefully read and agree with the tenancy agreement and any inventory provided before signing these documents.","Wiltshire Way, Bath BA1",pre-owned,to_rent,51.400038,-2.356991,residential,1750,1750,1750,1750,,1,3,3,3,2,False,False,False,"['https://lid.zoocdn.com/u/2400/1800/7fe8cff39ea1a5cb3fd67d4ed6bfccb53ea51a05.jpg', 'https://lid.zoocdn.com/u/2400/1800/fe12ad748c9b067548ebee61f2e8ddf8b73619d3.jpg', 'https://lid.zoocdn.com/u/2400/1800/feba6f809d6d1479d1be46c9cde0508f66b171a2.jpg', 'https://lid.zoocdn.com/u/2400/1800/bac7e8afc3fd7cf2f0b89411c4f622c1b3fff069.jpg', 'https://lid.zoocdn.com/u/2400/1800/185be827b0b0019d22f4c255ce0f5b18775ac0af.jpg', 'https://lid.zoocdn.com/u/2400/1800/d3736b171766d93f35ee2773c8c624a3ea1f58f4.jpg', 'https://lid.zoocdn.com/u/2400/1800/24b001b8a52e96eb084d0a152178238233b74a41.jpg', 'https://lid.zoocdn.com/u/2400/1800/4cc7535f903f5c193853a3ba8df8bc8bedd0ca13.jpg', 'https://lid.zoocdn.com/u/2400/1800/de1975b7a74beba02eb8ce4bf65761d8829166a7.jpg', 'https://lid.zoocdn.com/u/2400/1800/70bd45383acef807a2a464670a73b33428344be2.jpg', 'https://lid.zoocdn.com/u/2400/1800/872a3449fe9a04b1962302fdd4d01c5029335ee5.jpg', 'https://lid.zoocdn.com/u/2400/1800/0a400dc3b236309f1909f3e6327a69c8a7483395.jpg']","['3 Bedroom Property', 'Great Location', 'Bricklane partnership', 'Close to Local Schools', 'Built For Renters']",['https://www.allenandharris.co.uk/property/P3550J4925-77974959'],[],"7 Princes Buildings, George Street, Bath",Allen & Harris - Bath,01225 288623,2024-05-17,
50,66461652,https://www.zoopla.co.uk/to-rent/details/66461652/,flat,1 bed flat to rent,2024-01-22T19:41:22,933A488E-BC4A-4CE1-AFEA-BBC554D47D5A,BA1 8BE,"<strong>Overview</strong><br><br>Apartment 41 at Lambrook Court is a Second floor, South East facing, 1 Bed Apartment measuring 66.97 square metres.<br><br><strong>Summary</strong><br><br>Apartment 41 at Lambrook Court is a Second floor, South East facing, 1 Bed Apartment measuring 66.97 square metres.<br><br><strong>Council Tax</strong><br><br>Council tax band: C<br><br><strong>Reservation Deposit</strong><br><br>Reservation deposit: £500.00 (to be offset against your initial payment and fully refundable should your Tenancy not proceed)<br><br><strong>Security Deposit</strong><br><br>Security deposit: £4788.46 (equivalent to 5 weeks rent of the apartment only, excludes any parking space rent)","Gloucester Road, Larkhall, Bath BA1",pre-owned,to_rent,51.397492,-2.342062,residential,4150,4150,4250,4000,,1,1,1,1,,False,False,False,"['https://lid.zoocdn.com/u/2400/1800/fc01103c7e499c7d28c9cbd2acf6ed5c1e801c4e.jpg', 'https://lid.zoocdn.com/u/2400/1800/4e93527cffae3b502890e832ee1d464fbfa96b62.jpg', 'https://lid.zoocdn.com/u/2400/1800/0126b8badbb831094aac722876475162832ad782.jpg', 'https://lid.zoocdn.com/u/2400/1800/58737ed06ae1a5994ec6f6fa5e64141a180d9b1a.jpg', 'https://lid.zoocdn.com/u/2400/1800/791ae323db5305de3df1f0b1255f865978d4aef0.jpg', 'https://lid.zoocdn.com/u/2400/1800/27ead44794f3b39ae1770746db52986a3fd9411b.jpg', 'https://lid.zoocdn.com/u/2400/1800/f275cffddf5ff939a65eb15fd015f6acbe67792d.jpg', 'https://lid.zoocdn.com/u/2400/1800/4d732b16df6bc72e83a99b4a74f808c2fe2c07a2.jpg', 'https://lid.zoocdn.com/u/2400/1800/d943cae1fa046872a41c907d5e4ee3f65bfa5b7c.jpg', 'https://lid.zoocdn.com/u/2400/1800/7c753c77a1f4f60ddc6c1c91dd1421bea7f2d548.jpg', 'https://lid.zoocdn.com/u/2400/1800/dc38d6c1375af079bc8bdd4631eb975050816f7f.jpg', 'https://lid.zoocdn.com/u/2400/1800/fb4b8081cb3e48669615c57103b831c84bba7fc1.jpg', 'https://lid.zoocdn.com/u/2400/1800/6ef972d9015085475243e86a55194cf66c586f2f.jpg', 'https://lid.zoocdn.com/u/2400/1800/da684d9b16ce896a10366d625802ce8a44390623.jpg', 'https://lid.zoocdn.com/u/2400/1800/f02d185f6ac55a181cbac79e6b71114cd6136262.jpg', 'https://lid.zoocdn.com/u/2400/1800/b21e91a244c30227739125e558044b26f4cc1a1f.jpg']","['On-site Bistro style restaurant with expert chef', 'Flexible care tailored to your needs and preferences', 'Beautifully maintained, landscaped gardens', 'Great community with a Village feel and independent shops', 'Historic city centre nearby with Larkhall within walking distance', 'Balconies overlooking a babbling brook to numerous apartments', '24 hour staffing', 'Wheelchair access', 'Lifts to all floors', 'Camera entry system']",[],['https://lc.zoocdn.com/5c6110ad9efdb182b29ac5e7d3b463ce8f5fcc4a.png'],"4th Floor, 100 Holdenhurst Road, Bournemouth",McCarthy & Stone Rentals,01305 248385,2024-04-19,
