,id,url,propertyType,name,publishedOn,uuid,postalCode,description,address,listingCondition,listingStatus,latitude,longitude,category,price,priceActual,priceMax,priceMin,sqft,livingRooms,beds,bedsMax,bedsMin,baths,isRetirementHome,isSharedOwnership,studentFriendly,images,features,additionalLinks,floorPlan,agentAddress,agentName,agentPhone,availableFrom,floorArea
24,67057060,https://www.zoopla.co.uk/to-rent/details/67057060/,flat,1 bed flat to rent,2024-04-08T14:26:06,69634CB0-4DB2-42B0-AFCC-CE1B3A1461EF,BA1 2PR,"<strong>Overview</strong><br><br>Location - location A fully furnished First Floor spacious apartment overlooking a quiet pleasant square communal garden, five minute level walk from the City Centre. The property comprises of entrance hall, a spacious living room with original features, a fitted kitchen/breakfast room with views to the rear, double bedroom, bathroom with shower and gas central heating throughout. Parking is on street permit. The apartment is available to let from the end of May.<br>Council tax band: C","Catharine Place, Bath BA1",pre-owned,to_rent,51.3874,-2.36607,residential,1450,1450,1500,1250,,1,1,1,1,1,False,False,False,"['https://lid.zoocdn.com/u/2400/1800/7bbd199e91c9798177aee98be29a791c34474fd0.jpg', 'https://lid.zoocdn.com/u/2400/1800/a3005f0b085073c7d6053889ba48b472ea6eaa72.jpg', 'https://lid.zoocdn.com/u/2400/1800/3069a9f1801e9271c45357711da0093f15e1861d.jpg', 'https://lid.zoocdn.com/u/2400/1800/decc3d5a7889f0f517c8bb4a1ec096e96d51b24d.jpg', 'https://lid.zoocdn.com/u/2400/1800/72effd2d036339451c9e19faee6cc1272fb348d4.jpg', 'https://lid.zoocdn.com/u/2400/1800/0ba3589d3dd8ae0653dbeb1fe34c8524d0738c75.jpg', 'https://lid.zoocdn.com/u/2400/1800/69ec74f6179a0b21a5e3523c33785f44237a4204.jpg', 'https://lid.zoocdn.com/u/2400/1800/70fb024b46ea19c851a6f8ec765ad15e54d02679.jpg', 'https://lid.zoocdn.com/u/2400/1800/fc4c932528a86efc853b846a7cc77d40ed024549.jpg', 'https://lid.zoocdn.com/u/2400/1800/12d5f4452d1865a26b4cb0999dfebb6b3599ce19.jpg', 'https://lid.zoocdn.com/u/2400/1800/c54db3a611e49f62d9b1b7d6aae70487ce1d82fe.jpg', 'https://lid.zoocdn.com/u/2400/1800/2c7029d9af98b15358335e288f28a53b6f18a19b.jpg', 'https://lid.zoocdn.com/u/2400/1800/73b6aeaa6fb5b9d2b2b3b81909935b18b0efe1e9.jpg', 'https://lid.zoocdn.com/u/2400/1800/75f64252218ebc6e6809104d1540e388696f5cc2.jpg', 'https://lid.zoocdn.com/u/2400/1800/e85f4de17fa871a6efe743f724a6c0a736becb25.jpg', 'https://lid.zoocdn.com/u/2400/1800/e1ce5c0a56a0d20312f764aad66e2bb1bb1e2222.jpg']","['Fully Furnished', 'Close To City Centre', 'Fully Fitted Kitchen', 'Gas Central Heating', 'Quiet location']",[],[],"30 Charles Street, Bath",Property Link,01225 288074,2024-05-29T01:00:00,
25,66581813,https://www.zoopla.co.uk/to-rent/details/66581813/,flat,2 bed flat to rent,2024-02-07T11:54:19,25cf15f9-7b2a-4a3b-8390-6c733af41f22,BA1 5UE,"We have a 2 bedroom ground floor flat, for up to 3 people available in Bath. All applicants must be age 55 or above. Pets are not permitted.<br><br>Inside the flat you will find:-<br>A lounge, fitted kitchen and bathroom, 1 double bedroom and 1 single bedroom<br><br>The property has close transport links to the town centre it is also close to local amenities.<br><br>This home is available now, so please get in touch to express your interest. You won't have to pay a deposit or agent's fees; just required to pay a week’s rent plus an additional weeks rent in advance when signing your lease. Future rent payments must be paid by direct debit<br>We will also do a financial assessment for you, in case we can help with any financial support. We will work with you to get your account 4 weeks in advance in a way to suit your income.<br><br>We receive a lot of enquiries so if you do not hear from us within 5 working days, the flat will have been let.<br>Please note, dates and rent amount is approximate and is subject to change<br>As a provider of affordable housing an offer of a home will be subject to an affordability and financial assessment to ensure we comply with our charitable aims","Roman House, Walcot Gate, Bath BA1",pre-owned,to_rent,51.388951,-2.357063,residential,666,666,700,600,,0,2,2,2,1,False,False,False,['https://lid.zoocdn.com/u/2400/1800/8b42c9a5e4c9710cb2b277cb1eb7d77a0ff6bdc2.jpg'],[],[],[],"Bower House, Stable Street, Oldham",The Guinness Partnership,,,
26,62699381,https://www.zoopla.co.uk/to-rent/details/62699381/,detached,5 bed detached house to rent,2023-10-25T02:27:18,40cb9d56-0b24-4c52-872c-78f3f7044846,BA1 9AU,"This attractive and substantial detached property with accommodation set over three floors is beautifully presented throughout, with the benefit of a larger than average garden. The property has a large kitchen and living area on the ground floor with bi-folding doors opening out to the garden, and at first floor level an attractive separate sitting room with wonderful views towards the Welsh hills and Beckford’s Tower. There are four good size bedrooms, the two main ones being on the upper floor. The principal bedroom has French doors leading onto a balcony with superb views. To the rear, views overlook the playing fields, which are beautifully maintained, and beyond.This particular house also has the benefit of a large, double width driveway, with parking for four cars and double garage.<br><br>This three-storey substantial detached property is located on the Ensleigh development and is at the end of Beckford Drive, being adjacent but also well shielded, from the Kingswood playing fields.<br><br>Consequently, this particular property has a larger than average garden, driveway and double garage in comparison to many of the other properties in the same road.<br><br>This location is particularly well placed for easy access to the nearby recently built state primary school. Also nearby are St Stephens Primary School, The Royal High School, Kingswood School and King Edwards Pre-Prep. Although within only a few minute’s walk from the City Centre, there is also attractive open country side nearby with stunning walks, and amenities include the nearby Spar store. The development is also particularly well placed for easy access to junction 18 of the M4.<br><br>The unesco World Heritage City of Bath is within easy walking distance and offers a wonderful array of chain and independent retail outlets, many fine restaurants, cafes and wine bars along with a number of well-respected cultural activities which include the attractions at The Roman Baths and Pump Rooms, a world-famous international music and literary festival and many pre-London shows at The Theatre Royal.<br><br>World Class Sporting facilities are available at Bath Rugby and Cricket Clubs and at Bath University and there are excellent hotel, gym and spa facilities at the Royal Crescent and Priory Hotels.<br><br>Communications include a direct line to London Paddington, Bristol and South Wales from Bath Spa Railway Station, The M4 Motorway is 6 miles to the north and Bristol Airport is 18 miles to the west.","Beckford Drive, Lansdown, Bath BA1",pre-owned,to_rent,51.407571,-2.374834,residential,4500,4500,4500,4500,,2,5,5,5,3,False,False,False,"['https://lid.zoocdn.com/u/2400/1800/d1c73e3418b4abe59345c00d32bf2f4d56e3801b.jpg', 'https://lid.zoocdn.com/u/2400/1800/a2566461d8bf6d29e019343f149c1df6015d962b.jpg', 'https://lid.zoocdn.com/u/2400/1800/89977d62ba38063a6a4f0adf53dc45252377704c.jpg', 'https://lid.zoocdn.com/u/2400/1800/a9fcd74eaa21289ca3f08472c08abc391e179055.jpg', 'https://lid.zoocdn.com/u/2400/1800/b9606b5090f3cdce0247ee3b0c21b26347e61ca5.jpg', 'https://lid.zoocdn.com/u/2400/1800/625e1566726a2f30ade841c862dd69ebd3f8fc6b.jpg', 'https://lid.zoocdn.com/u/2400/1800/1f6987190ec5e4b30f8a263ae72f20b1dd2ebb29.jpg', 'https://lid.zoocdn.com/u/2400/1800/a65dcad6e21bc392ba8e6b0897504f6ee6604180.jpg', 'https://lid.zoocdn.com/u/2400/1800/652aaf7be097a820e0ed49be1f11dd25076d8aed.jpg', 'https://lid.zoocdn.com/u/2400/1800/4503fcfec2426be1183f5cb32174e62d7a537f99.jpg', 'https://lid.zoocdn.com/u/2400/1800/c774d8182f8d89d782744ee4af0b9a5d138b9d75.jpg', 'https://lid.zoocdn.com/u/2400/1800/ab40050e80febdc85c4511bcf9b33511a359317f.jpg', 'https://lid.zoocdn.com/u/2400/1800/bf7b4cfc62e53355809f4b5394139807b55d9f2c.jpg', 'https://lid.zoocdn.com/u/2400/1800/7a5c6e05b99f90982f96b532f79a5ba3c7ef7ae1.jpg', 'https://lid.zoocdn.com/u/2400/1800/eb0ebf6fc84fecfdf843c9d780f5f42bad46ec34.jpg', 'https://lid.zoocdn.com/u/2400/1800/3162325edce9920712d16b4e2da2b135a83809a4.jpg', 'https://lid.zoocdn.com/u/2400/1800/16dffcce879072953f38c336d86a317f876b4515.jpg', 'https://lid.zoocdn.com/u/2400/1800/a92b8bc11c1d222745b94b3aa2273c7614d9c2c0.jpg', 'https://lid.zoocdn.com/u/2400/1800/c3173ff63c7cd95251ecaa9f4227e885305ecf27.jpg', 'https://lid.zoocdn.com/u/2400/1800/4f935b7e33f8eb18c7128bd4602b9d96ffb60c25.jpg', 'https://lid.zoocdn.com/u/2400/1800/86aad3ed013f523424ac086ddbcda13582108a9e.jpg', 'https://lid.zoocdn.com/u/2400/1800/f467de19acaff19a04399bd5aab235562925d856.jpg', 'https://lid.zoocdn.com/u/2400/1800/770b7ffb732f18541f095291af88aca8395a4800.jpg', 'https://lid.zoocdn.com/u/2400/1800/576582fe4ed90414f8b9920993aeab02039a2b3d.jpg', 'https://lid.zoocdn.com/u/2400/1800/e5d27cbc4ac9e524e065527fc05918df80ec1f30.png']","['Substantial three storey detached property', '2 reception rooms', '3 bathrooms', '4/5 bedrooms', 'Attractive good size garden', 'Double garage', 'Double width driveway and parking for 4 cars', 'Views']",['https://lc.zoocdn.com/b9a06ed0a66db996eb2980338f725af68cd5198e.pdf'],['https://lc.zoocdn.com/a65dd35a651f387c377db13b5f1d6ba41242a869.jpg'],"35 Brock Street, Bath",Cobb Farr Residential,01225 288613,2023-12-18T00:00:00,
27,65802986,https://www.zoopla.co.uk/to-rent/details/65802986/,flat,2 bed flat to rent,2023-10-11T09:41:32,d1e65d16-a82f-496b-845b-f6e5d798a114,BA1 5UF,"We have two, 2 bedroom ground floor flats, for up to 3 people available in Bath. All applicants must be age 60 or above. Pets are not permitted.<br><br>Inside the flats you will find:-<br>A lounge, fitted kitchen and bathroom, 1 double bedroom and 1 single bedroom.<br><br>The property has close transport links to the town centre it is also close to local amenities.<br><br>This home is available now, so please get in touch to express your interest. You won't have to pay a deposit or agent's fees; just required to pay a week’s rent plus an additional weeks rent in advance when signing your lease. Future rent payments must be paid by direct debit<br><br>We will also do a financial assessment for you, in case we can help with any financial support. We will work with you to get your account 4 weeks in advance in a way to suit your income.<br><br>We receive a lot of enquiries so if you do not hear from us within 5 working days, the flat will have been let.<br>Please note, dates and rent amount is approximate and is subject to change<br>As a provider of affordable housing an offer of a home will be subject to an affordability and financial assessment to ensure we comply with our charitable aims.","Caern Well Place, Bath BA1",pre-owned,to_rent,51.388859,-2.357666,residential,738,738,800,700,,0,2,2,2,1,False,False,False,[],[],[],[],"Bower House, Stable Street, Oldham",The Guinness Partnership,,,
28,66815406,https://www.zoopla.co.uk/to-rent/details/66815406/,flat,2 bed flat to rent,2024-03-07T15:42:15,F552CB4A-8BC8-4E24-9586-E0EB7DA4EE19,BA1 8BE,"<strong>Overview</strong><br><br>Enjoy all of the benefits of a McCarthy Stone retirement community with our assured, affordable and flexible tenancies, so you can rent your property for as long as you want (subject to a minimum term). Renting in retirement provides a wealth of benefits including one monthly fee, removing any worries you may have about the upkeep of your property and the grounds. You can move in at your pace, knowing there's long-term security with one of our Assured Tenancies and settle in to your new home with minimum fuss.<br><br>Apartment 25 at Lambrook Court is a First floor, North East facing, 2 Bed Apartment measuring 74.69 square metres.<br><br>Lambrook Court boasts a prime location in beautiful, historic Bath, a world-renowned spa town and the only in the UK to have the whole city granted World Heritage Site status. This fine collection of age-exclusive apartments is a must-see for those seeking Retirement Living plus in Bath.<br><br>Lambrook Court provides the level of freedom needed for homeowners to maintain their independence for longer and live retirement to the full. There is an on-site, 24 hour, Estates Management team and a 24 hour emergency call system so residents can receive flexible care and support in their own home. Additionally, all external property maintenance including gardening and window cleaning is taken care of.<br><br>Lambrook Court features stylish one and two bedroom properties, all of which are spacious, modern, and perfect for a relaxed and independent retirement. The apartments at Lambrook Court include generously sized bedrooms, large living areas and high quality kitchens and bathrooms. Homeowners benefit from double glazing and underfloor heating, with selected apartments featuring private balconies or patio areas. There is plenty of storage throughout your property, including walk-in or built in wardrobes, and every room is finished with high spec fittings. Your home at Lambrook Court is high quality, easy to maintain and provides exceptional security systems, delivering you the peace of mind to enjoy a stress-free retirement.<br><br>Away from the privacy of your apartment, Lambrook Court features several social areas, including a restaurant, homeowners' lounge and function room. The gardens are beautiful and well maintained, meaning you can enjoy the fresh air and flowers without having to lift a finger. And when it comes to your friends and family visiting your new home, they too can enjoy comfort and privacy in the guest suite<br><br><strong>Summary</strong><br><br>Enjoy all of the benefits of a McCarthy Stone retirement community with our assured, affordable and flexible tenancies, so you can rent your property for as long as you want (subject to a minimum term). Renting in retirement provides a wealth of benefits including one monthly fee, removing any worries you may have about the upkeep of your property and the grounds. You can move in at your pace, knowing there's long-term security with one of our Assured Tenancies and settle in to your new home with minimum fuss.<br><br>Apartment 25 at Lambrook Court is a First floor, North East facing, 2 Bed Apartment measuring 74.69 square metres.<br><br>Lambrook Court boasts a prime location in beautiful, historic Bath, a world-renowned spa town and the only in the UK to have the whole city granted World Heritage Site status. This fine collection of age-exclusive apartments is a must-see for those seeking Retirement Living plus in Bath.<br><br>Lambrook Court provides the level of freedom needed for homeowners to maintain their independence for longer and live retirement to the full. There is an on-site, 24 hour, Estates Management team and a 24 hour emergency call system so residents can receive flexible care and support in their own home. Additionally, all external property maintenance including gardening and window cleaning is taken care of.<br><br>Lambrook Court features stylish one and two bedroom properties, all of which are spacious, modern, and perfect for a relaxed and independent retirement. The apartments at Lambrook Court include generously sized bedrooms, large living areas and high quality kitchens and bathrooms. Homeowners benefit from double glazing and underfloor heating, with selected apartments featuring private balconies or patio areas. There is plenty of storage throughout your property, including walk-in or built in wardrobes, and every room is finished with high spec fittings. Your home at Lambrook Court is high quality, easy to maintain and provides exceptional security systems, delivering you the peace of mind to enjoy a stress-free retirement.<br><br>Away from the privacy of your apartment, Lambrook Court features several social areas, including a restaurant, homeowners' lounge and function room. The gardens are beautiful and well maintained, meaning you can enjoy the fresh air and flowers without having to lift a finger. And when it comes to your friends and family visiting your new home, they too can enjoy comfort and privacy in the guest suite<br><br><strong>Council Tax</strong><br><br>Council tax band: D<br><br><strong>Reservation Deposit</strong><br><br>Reservation deposit: £500.00 (to be offset against your initial payment and fully refundable should your Tenancy not proceed)<br><br><strong>Security Deposit</strong><br><br>Security deposit: £4500.00 (equivalent to 5 weeks rent of the apartment only, excludes any parking space rent)","Gloucester Road, Larkhall, Bath BA1",pre-owned,to_rent,51.397492,-2.342062,residential,3900,3900,4000,3750,,1,2,2,2,,True,False,False,"['https://lid.zoocdn.com/u/2400/1800/fc01103c7e499c7d28c9cbd2acf6ed5c1e801c4e.jpg', 'https://lid.zoocdn.com/u/2400/1800/4e93527cffae3b502890e832ee1d464fbfa96b62.jpg', 'https://lid.zoocdn.com/u/2400/1800/0126b8badbb831094aac722876475162832ad782.jpg', 'https://lid.zoocdn.com/u/2400/1800/58737ed06ae1a5994ec6f6fa5e64141a180d9b1a.jpg', 'https://lid.zoocdn.com/u/2400/1800/791ae323db5305de3df1f0b1255f865978d4aef0.jpg', 'https://lid.zoocdn.com/u/2400/1800/27ead44794f3b39ae1770746db52986a3fd9411b.jpg', 'https://lid.zoocdn.com/u/2400/1800/f275cffddf5ff939a65eb15fd015f6acbe67792d.jpg', 'https://lid.zoocdn.com/u/2400/1800/4d732b16df6bc72e83a99b4a74f808c2fe2c07a2.jpg', 'https://lid.zoocdn.com/u/2400/1800/d943cae1fa046872a41c907d5e4ee3f65bfa5b7c.jpg', 'https://lid.zoocdn.com/u/2400/1800/7c753c77a1f4f60ddc6c1c91dd1421bea7f2d548.jpg', 'https://lid.zoocdn.com/u/2400/1800/dc38d6c1375af079bc8bdd4631eb975050816f7f.jpg', 'https://lid.zoocdn.com/u/2400/1800/fb4b8081cb3e48669615c57103b831c84bba7fc1.jpg', 'https://lid.zoocdn.com/u/2400/1800/6ef972d9015085475243e86a55194cf66c586f2f.jpg', 'https://lid.zoocdn.com/u/2400/1800/da684d9b16ce896a10366d625802ce8a44390623.jpg', 'https://lid.zoocdn.com/u/2400/1800/f02d185f6ac55a181cbac79e6b71114cd6136262.jpg', 'https://lid.zoocdn.com/u/2400/1800/b21e91a244c30227739125e558044b26f4cc1a1f.jpg']","['On-site Bistro style restaurant with expert chef', 'Flexible care tailored to your needs and preferences', 'Beautifully maintained, landscaped gardens', 'Great community with a Village feel and independent shops', 'Historic city centre nearby with Larkhall within walking distance', 'Balconies overlooking a babbling brook to numerous apartments', '24 hour staffing', 'Wheelchair access', 'Lifts to all floors', 'Camera entry system']",[],['https://lc.zoocdn.com/deea086985e971c18ed030e9b01a6b53f08e69d0.png'],"4th Floor, 100 Holdenhurst Road, Bournemouth",McCarthy & Stone Rentals,01305 248385,2024-05-20,
29,66689533,https://www.zoopla.co.uk/to-rent/details/66689533/,maisonette,3 bed maisonette to rent,2024-02-20T22:52:36,D8354C7F-BAAD-4391-A568-66A5DC6B4D3F,BA3 5GG,"A Stunning three bedroom three bathroom (two en-suite) Penthouse apartment situated over two floors (floors four and five) 1237 sqf located within a former listed brewery situated in a gorgeous village location with a real community feel. This Luxury property was designed with no expense spared by an American Interior Designer, can be supplied furnished as shown at no extra cost, or unfurnished if preferred. Former Show Home.<br><br>The property accommodation comprises: Hallway, Open planned kitchen/lounge with vaulted ceiling, exposed beams, the kitchen area has a breakfast bar, integrated dishwasher, integrated fridge/freezer, gas hob, fan assisted oven, cooker hood, bathroom with shower over the bath, third bedroom with sliding double wardrobes, laundry cupboard, upstairs can be found a glass and oak galleried landing, eaves storage, master bedroom with en-suite bathroom, second double bedroom with eaves storage and a bathroom. The property also benefits from two parking spaces, gas central heating, double glazing, communal roof top garden, communal lift, communal garden, communal indoor heated swimming pool and communal 24 hour gym.<br><br>No smokers allowed and No pets allowed. 100pcm extra on top of the rent for the service charge. Five weeks deposit required - 2,292.31<br><br>Available now.<br><strong>EPC- C</strong><br><br>Council Tax Band - D<br><br>tenants: If you choose to take the tenancy on one of our properties; we will ask you to pay a holding deposit of one week?s rent per property. This is taken as a holding deposit to reserve you the Property and will be reimbursed off of the first month?s rent, unless you fail the credit checks and referencing and then we will be entitled to deduct and retain from the holding deposit. E.G. If the rent is 850pcm then the holding fee will be 196.15. We will be entitled to deduct and retain from the holding deposit if you decide to withdraw from the tenancy or if you fail your credit checks, provide false or misleading information, fail to provide the documents or evidence requested or fail the right to rent checks; it will be refundable if the landlord decides to withdraw.<br>Property Particulars: We endeavour to make our property particulars accurate and reliable, however, they do not constitute or form part of an offer or any contract and none is to be relied upon as statements of representation or fact. Any services, systems and appliances listed in this specification have not been tested by us and no guarantee as to their operating ability or efficiency is given. All measurements have been taken as a guide to prospective renters only, and are not precise. If you require clarification or further information on any points, please contact us, especially if you are travelling some distance to view.<br>Redress Scheme: The Property Ombudsman - <br>Tenancy Deposit Scheme: We lodge deposits with the dps ? Deposit Protection Scheme<br>Client Money Protection Insurance ? Member of Client Money Protect - CMP004791","Old Brewery Place, Oakhill, Nr Radstock BA3",pre-owned,to_rent,51.223376,-2.528232,residential,2000,2000,2000,2000,,0,3,3,3,,False,False,False,"['https://lid.zoocdn.com/u/2400/1800/5e634282f5c9cbc8a0f7e08c361b469db29f5eb9.jpg', 'https://lid.zoocdn.com/u/2400/1800/0bcec3574d51f38d5f8ce8cf65edfc0022584e35.jpg', 'https://lid.zoocdn.com/u/2400/1800/afa1d5116445836bdb7204656323c1c9cd2eb832.jpg', 'https://lid.zoocdn.com/u/2400/1800/b49f73f02a9c21701cb1781dd6c88f41142d9617.jpg', 'https://lid.zoocdn.com/u/2400/1800/99d98623961c1bf0fabf1305102232b5bdab331b.jpg', 'https://lid.zoocdn.com/u/2400/1800/8950f102cb62a286d10c1a8b279e59e961f5063a.jpg', 'https://lid.zoocdn.com/u/2400/1800/a526345351d172893cfa8143b0b1061424b21d2d.jpg', 'https://lid.zoocdn.com/u/2400/1800/5c5be8b7d11f8dba2e723e3b9214af2ed23583b9.jpg', 'https://lid.zoocdn.com/u/2400/1800/ea710f6ffacc7d1a9c043fdaf5e29b592f2fa8c6.jpg', 'https://lid.zoocdn.com/u/2400/1800/e6345725109e2b2c106e8f84a3b7952e59f5898b.jpg', 'https://lid.zoocdn.com/u/2400/1800/3f18c131ee9ba8b07ae239d841689530c7c128dd.jpg', 'https://lid.zoocdn.com/u/2400/1800/78056fc6155f36fd3f52d7bd14f341bd62e898cb.jpg', 'https://lid.zoocdn.com/u/2400/1800/52107c803e6becd5dc94bb0ca150d5f573e37d99.jpg', 'https://lid.zoocdn.com/u/2400/1800/15cc5200a9b9b719451ead5b16d3ba6c7ffc79fa.jpg', 'https://lid.zoocdn.com/u/2400/1800/f877d6f62f4294750334c38a9bb9f223c2e2f8d5.jpg', 'https://lid.zoocdn.com/u/2400/1800/3f9b67713ac7c7ce44120f89acfe2d140e696d94.jpg', 'https://lid.zoocdn.com/u/2400/1800/fcb3465e55a792e5c5fc8c62b270914261e646d9.jpg', 'https://lid.zoocdn.com/u/2400/1800/625cad7d932477d95778390be40cceb30fa2a848.jpg']","['Council Tax Band: D', 'Deposit: 2,523 (gbp)', 'Three Bedrooms Detached', 'One Reception Room', 'Three Bathrooms', 'En-Suite', 'Allocated Parking', 'Double Glazing', 'Council Tax Band D', 'Open Galleried Landing']",[],['https://lc.zoocdn.com/710cadc20e9f6a062cc2d82196910f2ba773d9b1.jpg'],"8 Harris Close, Frome",Lettings-R-US Ltd,01373 316930,2024-04-03T00:00:00,
